{
  "id": "miniprogram-runtime-standard",
  "type": "primary-platform",
  "status": "draft",
  "displayName": "Mini Program Runtime Standard Pack",
  "baselineLayer": "standard",
  "recommendedForBL": [
    "BL0_LIGHTWEIGHT",
    "BL1_STANDARD",
    "BL2_INDUSTRIAL"
  ],
  "allowedForBL": [
    "BL0_LIGHTWEIGHT",
    "BL1_STANDARD",
    "BL2_INDUSTRIAL"
  ],
  "activeByDefault": false,
  "appliesToProfiles": [
    "wechat-miniprogram"
  ],
  "recommendedWhen": [
    "WeChat Mini Program pages, components, lifecycle, platform API, or runtime behavior is in scope"
  ],
  "canBeRecommendedByAI": true,
  "selectionRequiresHumanDecision": true,
  "canAuthorizeWrites": false,
  "canApproveImplementation": false,
  "canApproveRelease": false,
  "canApproveComplianceSecurityPrivacy": false,
  "requiresEvidenceForConfirmed": true,
  "maturityStage": "draft"
}
