{
  "id": "release-rollback-standard",
  "type": "release",
  "status": "draft",
  "displayName": "Release and Rollback Standard Pack",
  "baselineLayer": "standard",
  "recommendedForBL": [
    "BL1_STANDARD",
    "BL2_INDUSTRIAL"
  ],
  "allowedForBL": [
    "BL0_LIGHTWEIGHT",
    "BL1_STANDARD",
    "BL2_INDUSTRIAL"
  ],
  "activeByDefault": false,
  "appliesToProfiles": [],
  "recommendedWhen": [
    "project has staging deployment",
    "project has production deployment",
    "release or rollback is in scope",
    "handoff or launch readiness is claimed"
  ],
  "canBeRecommendedByAI": true,
  "selectionRequiresHumanDecision": true,
  "canAuthorizeWrites": false,
  "canApproveImplementation": false,
  "canApproveRelease": false,
  "canApproveComplianceSecurityPrivacy": false,
  "requiresEvidenceForConfirmed": true,
  "maturityStage": "draft"
}
